{"artifact":{"kind":"unsigned-transaction-material","media_type":"application/vnd.kaspa.transaction-review+binary","sha256":"sha256:0d4444ffd470eef55102e241053784edab89cc82a18883085a139540395486da","size_bytes":34},"canvas_digest":"sha256:d70b55dd2d76d51b834c73c3709efa1cc4b35f323c1057867fce33ce0495bdcc","confirmation_id":"confirmation:sha256:a3980cf5210525b110bb181aa45531255eeac1af132ed785557f3f4bb9318a54","confirmed_at":"2026-09-01T00:00:00.000Z","content_digest":"sha256:734f728ea975f45be8468598701223ec74793d3603a7440065abe6641a4b9025","schema":"covhub.code-confirmation/v1","status":"confirmed","tests":[{"evidence_digest":"sha256:1111111111111111111111111111111111111111111111111111111111111111","runner":"covhub.runner/v0","status":"pass","test_id":"happy-path"}]}
